{
  "authority": {
    "git_operations_blocked": true,
    "helper_is_bounded": true,
    "install_token_required": true,
    "manifest_is_not_permission": true,
    "network_access_blocked": true,
    "private_context_blocked": true
  },
  "direct_repo_paths": [
    "pyproject.toml",
    "scripts/install.sh",
    "tools/__init__.py",
    "tools/version.py",
    "tools/konoha_cli.py",
    "tools/command_registry.py",
    "tools/distribution/__init__.py",
    "tools/distribution/manage_konoha_distribution.py",
    "tools/distribution/run_clean_install_smoke.py",
    "tools/release_delivery/__init__.py",
    "tools/release_delivery/run_supervised_package_release.py",
    "tests/konoha_cli/test_konoha_cli.py",
    "tests/distribution/test_managed_distribution.py",
    "tests/release_delivery/test_run_supervised_package_release.py",
    "schemas/runtime/managed_konoha_install_state.schema.json",
    "schemas/runtime/managed_konoha_install_status.schema.json",
    "schemas/runtime/konoha_clean_install_smoke_report.schema.json",
    "schemas/runtime/supervised_package_release_plan.schema.json",
    "schemas/runtime/supervised_package_release_report.schema.json",
    "examples/distribution/managed_konoha_install_state.example.json",
    "examples/release_delivery/v3_3_0_supervised_package_release_plan.example.json",
    "examples/package_installation/v3_3_0_installable_terminal_distribution_manifest.example.json",
    "examples/release_workflow/v3_3_0_installable_terminal_distribution_release_plan.example.json",
    "docs/guides/installable_terminal_distribution.md",
    "docs/guides/managed_install_upgrade_and_uninstall.md",
    "docs/guides/supervised_package_to_release_wrapper.md",
    "docs/reference/capability_matrix.md",
    "docs/reference/release_safety_boundaries.md",
    "docs/roadmap/v3_3_0_installable_terminal_distribution_scope.md",
    "scrolls/v3_3_0_installable_terminal_distribution_review_scroll.md"
  ],
  "expected_base_commit": "32adef8b5a99d85a914e97eec775552464ff078f",
  "expected_branch": "main",
  "expected_public_paths": [
    "CHANGELOG.md",
    "README.md",
    "docs/guides/README.md",
    "docs/guides/installable_terminal_distribution.md",
    "docs/guides/managed_install_upgrade_and_uninstall.md",
    "docs/guides/supervised_package_to_release_wrapper.md",
    "docs/reference/capability_matrix.md",
    "docs/reference/release_safety_boundaries.md",
    "docs/roadmap.md",
    "docs/roadmap/v3_3_0_installable_terminal_distribution_scope.md",
    "examples/distribution/managed_konoha_install_state.example.json",
    "examples/package_installation/v3_3_0_installable_terminal_distribution_manifest.example.json",
    "examples/release_delivery/v3_3_0_supervised_package_release_plan.example.json",
    "examples/release_workflow/v3_3_0_installable_terminal_distribution_release_plan.example.json",
    "pyproject.toml",
    "schemas/runtime/konoha_clean_install_smoke_report.schema.json",
    "schemas/runtime/managed_konoha_install_state.schema.json",
    "schemas/runtime/managed_konoha_install_status.schema.json",
    "schemas/runtime/supervised_package_release_plan.schema.json",
    "schemas/runtime/supervised_package_release_report.schema.json",
    "scripts/install.sh",
    "scrolls/v3_3_0_installable_terminal_distribution_review_scroll.md",
    "tests/distribution/test_managed_distribution.py",
    "tests/konoha_cli/test_konoha_cli.py",
    "tests/release_delivery/test_run_supervised_package_release.py",
    "tools/__init__.py",
    "tools/command_registry.py",
    "tools/distribution/__init__.py",
    "tools/distribution/manage_konoha_distribution.py",
    "tools/distribution/run_clean_install_smoke.py",
    "tools/konoha_cli.py",
    "tools/release_delivery/__init__.py",
    "tools/release_delivery/run_supervised_package_release.py",
    "tools/version.py"
  ],
  "helper_approval_token": "APPLY_V3_3_0_INDEX_UPDATES",
  "helper_modified_paths": [
    "README.md",
    "CHANGELOG.md",
    "docs/roadmap.md",
    "docs/guides/README.md"
  ],
  "helper_path": "sandbox/tmp/v3-3-0-package/apply_v3_3_0.py",
  "installation_id": "v3-3-0-installable-terminal-distribution",
  "report_type": "supervised_package_installation_manifest",
  "schema_version": "1.0.0",
  "tracking_ref": "origin/main"
}
