{
  "authority": {
    "git_operations_blocked": true,
    "helper_is_bounded": true,
    "install_token_required": true,
    "manifest_is_not_permission": true,
    "network_access_blocked": true,
    "private_context_blocked": true
  },
  "direct_repo_paths": [
    "pyproject.toml",
    "scripts/install.sh",
    "tools/version.py",
    "tools/konoha_cli.py",
    "tools/command_registry.py",
    "tools/product_experience/__init__.py",
    "tools/product_experience/run_product_experience.py",
    "tools/distribution/manage_konoha_distribution.py",
    "tools/distribution/run_clean_install_smoke.py",
    "tests/product_experience/test_product_experience.py",
    "tests/konoha_cli/test_konoha_cli.py",
    "tests/distribution/test_managed_distribution.py",
    "schemas/runtime/konoha_product_experience_report.schema.json",
    "schemas/runtime/konoha_product_experience_state.schema.json",
    "examples/product_experience/product_experience_state.example.json",
    "docs/guides/finished_local_first_terminal_product.md",
    "docs/guides/quickstart_and_mission_journey.md",
    "docs/reference/capability_matrix.md",
    "docs/reference/release_safety_boundaries.md",
    "docs/roadmap/v3_4_0_finished_terminal_product_scope.md",
    "scrolls/v3_4_0_finished_terminal_product_review_scroll.md",
    "examples/package_installation/v3_4_0_finished_terminal_product_manifest.example.json",
    "examples/release_workflow/v3_4_0_finished_terminal_product_release_plan.example.json",
    "examples/release_delivery/v3_4_0_finished_terminal_product_delivery_plan.example.json",
    "docs/guides/installable_terminal_distribution.md",
    "docs/guides/unified_cli_entrypoint.md",
    "examples/cli/konoha_command_registry.example.json",
    "examples/distribution/managed_konoha_install_state.example.json"
  ],
  "expected_base_commit": "4b635a58d2cbe8328a2dd58be7329de024410a74",
  "expected_branch": "main",
  "expected_public_paths": [
    "CHANGELOG.md",
    "README.md",
    "docs/guides/README.md",
    "docs/guides/finished_local_first_terminal_product.md",
    "docs/guides/installable_terminal_distribution.md",
    "docs/guides/quickstart_and_mission_journey.md",
    "docs/guides/unified_cli_entrypoint.md",
    "docs/reference/capability_matrix.md",
    "docs/reference/release_safety_boundaries.md",
    "docs/roadmap.md",
    "docs/roadmap/v3_4_0_finished_terminal_product_scope.md",
    "examples/README.md",
    "examples/cli/konoha_command_registry.example.json",
    "examples/distribution/managed_konoha_install_state.example.json",
    "examples/package_installation/v3_4_0_finished_terminal_product_manifest.example.json",
    "examples/product_experience/product_experience_state.example.json",
    "examples/release_delivery/v3_4_0_finished_terminal_product_delivery_plan.example.json",
    "examples/release_workflow/v3_4_0_finished_terminal_product_release_plan.example.json",
    "pyproject.toml",
    "schemas/runtime/konoha_product_experience_report.schema.json",
    "schemas/runtime/konoha_product_experience_state.schema.json",
    "scripts/install.sh",
    "scrolls/README.md",
    "scrolls/v3_4_0_finished_terminal_product_review_scroll.md",
    "tests/distribution/test_managed_distribution.py",
    "tests/konoha_cli/test_konoha_cli.py",
    "tests/product_experience/test_product_experience.py",
    "tools/README.md",
    "tools/command_registry.py",
    "tools/distribution/manage_konoha_distribution.py",
    "tools/distribution/run_clean_install_smoke.py",
    "tools/konoha_cli.py",
    "tools/product_experience/__init__.py",
    "tools/product_experience/run_product_experience.py",
    "tools/version.py"
  ],
  "helper_approval_token": "APPLY_V3_4_0_INDEX_UPDATES",
  "helper_modified_paths": [
    "README.md",
    "CHANGELOG.md",
    "docs/roadmap.md",
    "docs/guides/README.md",
    "tools/README.md",
    "examples/README.md",
    "scrolls/README.md"
  ],
  "helper_path": "sandbox/tmp/v3-4-0-package/apply_v3_4_0.py",
  "installation_id": "v3-4-0-finished-local-first-terminal-product",
  "report_type": "supervised_package_installation_manifest",
  "schema_version": "1.0.0",
  "tracking_ref": "origin/main"
}
