{
  "authority": {
    "git_operations_blocked": true,
    "helper_is_bounded": true,
    "install_token_required": true,
    "manifest_is_not_permission": true,
    "network_access_blocked": true,
    "private_context_blocked": true
  },
  "direct_repo_paths": [
    "docs/guides/package_installation_scope_guard.md",
    "docs/roadmap/v3_2_5_package_installation_scope_guard_scope.md",
    "examples/package_installation/supervised_package_installation_manifest.example.json",
    "examples/release_workflow/v3_2_5_package_installation_release_plan.example.json",
    "schemas/runtime/supervised_package_installation_manifest.schema.json",
    "schemas/runtime/supervised_package_installation_report.schema.json",
    "scrolls/package_installation_scope_guard_review_scroll.md",
    "tests/package_installation/test_run_supervised_package_installation.py",
    "tools/package_installation/__init__.py",
    "tools/package_installation/run_supervised_package_installation.py"
  ],
  "expected_base_commit": "4f665e3a6d29ea9d480a5aa2ebe0b35cce1f608f",
  "expected_branch": "main",
  "expected_public_paths": [
    "CHANGELOG.md",
    "README.md",
    "docs/guides/README.md",
    "docs/guides/package_installation_scope_guard.md",
    "docs/roadmap.md",
    "docs/roadmap/v3_2_5_package_installation_scope_guard_scope.md",
    "examples/README.md",
    "examples/package_installation/supervised_package_installation_manifest.example.json",
    "examples/release_workflow/v3_2_5_package_installation_release_plan.example.json",
    "schemas/runtime/supervised_package_installation_manifest.schema.json",
    "schemas/runtime/supervised_package_installation_report.schema.json",
    "scrolls/README.md",
    "scrolls/package_installation_scope_guard_review_scroll.md",
    "tests/package_installation/test_run_supervised_package_installation.py",
    "tools/README.md",
    "tools/package_installation/__init__.py",
    "tools/package_installation/run_supervised_package_installation.py"
  ],
  "helper_approval_token": "APPLY_V3_2_5_INDEX_UPDATES",
  "helper_modified_paths": [
    "CHANGELOG.md",
    "README.md",
    "docs/guides/README.md",
    "docs/roadmap.md",
    "examples/README.md",
    "scrolls/README.md",
    "tools/README.md"
  ],
  "helper_path": "sandbox/tmp/v3-2-5-package/apply_v3_2_5.py",
  "installation_id": "v3-2-5-package-installation-scope-guard",
  "report_type": "supervised_package_installation_manifest",
  "schema_version": "1.0.0",
  "tracking_ref": "origin/main"
}
