{
  "authority": {
    "git_operations_blocked": true,
    "helper_is_bounded": true,
    "install_token_required": true,
    "manifest_is_not_permission": true,
    "network_access_blocked": true,
    "private_context_blocked": true
  },
  "direct_repo_paths": [
    "CHANGELOG.md",
    "README.md",
    "docs/guides/README.md",
    "docs/guides/integration_memory_and_mission_closure.md",
    "docs/guides/teachback_protocol_gate.md",
    "docs/guides/unified_cli_entrypoint.md",
    "docs/reference/capability_matrix.md",
    "docs/reference/release_safety_boundaries.md",
    "docs/roadmap.md",
    "docs/roadmap/v3_2_6_repository_consolidation_scope.md",
    "examples/cli/konoha_command_registry.example.json",
    "examples/mission_closure/mission_closure_sources.example.json",
    "examples/package_installation/v3_2_6_repository_consolidation_manifest.example.json",
    "examples/release_workflow/v3_2_6_repository_consolidation_release_plan.example.json",
    "examples/teachback/teachback_record.example.json",
    "protocols/teachback/teachback_policy.md",
    "schemas/runtime/konoha_command_registry.schema.json",
    "schemas/runtime/mission_closure_report.schema.json",
    "schemas/runtime/teachback_record.schema.json",
    "scrolls/repository_consolidation_teachback_cli_review_scroll.md",
    "tests/beta_runtime/test_run_konoha_beta.py",
    "tests/hokage_shell/test_teachback_integration.py",
    "tests/konoha_cli/test_konoha_cli.py",
    "tests/mission_closure/test_close_mission.py",
    "tests/mission_closure/test_manage_teachback.py",
    "tools/beta_runtime/run_konoha_beta.py",
    "tools/command_registry.py",
    "tools/hokage_shell/run_hokage_shell.py",
    "tools/konoha_cli.py",
    "tools/mission_closure/__init__.py",
    "tools/mission_closure/close_mission.py",
    "tools/mission_runtime/run_unified_mission.py",
    "tools/product_runtime/konoha_product.py",
    "tools/teachback/__init__.py",
    "tools/teachback/manage_teachback.py"
  ],
  "expected_base_commit": "a100eb6570c95a2700dfc1903d151fba3a9cbd2b",
  "expected_branch": "main",
  "expected_public_paths": [
    "CHANGELOG.md",
    "README.md",
    "docs/guides/README.md",
    "docs/guides/integration_memory_and_mission_closure.md",
    "docs/guides/teachback_protocol_gate.md",
    "docs/guides/unified_cli_entrypoint.md",
    "docs/reference/capability_matrix.md",
    "docs/reference/release_safety_boundaries.md",
    "docs/roadmap.md",
    "docs/roadmap/v3_2_6_repository_consolidation_scope.md",
    "examples/README.md",
    "examples/cli/konoha_command_registry.example.json",
    "examples/mission_closure/mission_closure_sources.example.json",
    "examples/package_installation/v3_2_6_repository_consolidation_manifest.example.json",
    "examples/release_workflow/v3_2_6_repository_consolidation_release_plan.example.json",
    "examples/teachback/teachback_record.example.json",
    "protocols/teachback/teachback_policy.md",
    "schemas/runtime/konoha_command_registry.schema.json",
    "schemas/runtime/mission_closure_report.schema.json",
    "schemas/runtime/teachback_record.schema.json",
    "scrolls/README.md",
    "scrolls/repository_consolidation_teachback_cli_review_scroll.md",
    "tests/beta_runtime/test_run_konoha_beta.py",
    "tests/hokage_shell/test_teachback_integration.py",
    "tests/konoha_cli/test_konoha_cli.py",
    "tests/mission_closure/test_close_mission.py",
    "tests/mission_closure/test_manage_teachback.py",
    "tools/README.md",
    "tools/beta_runtime/run_konoha_beta.py",
    "tools/command_registry.py",
    "tools/hokage_shell/run_hokage_shell.py",
    "tools/konoha_cli.py",
    "tools/mission_closure/__init__.py",
    "tools/mission_closure/close_mission.py",
    "tools/mission_runtime/run_unified_mission.py",
    "tools/product_runtime/konoha_product.py",
    "tools/teachback/__init__.py",
    "tools/teachback/manage_teachback.py"
  ],
  "helper_approval_token": "APPLY_V3_2_6_INDEX_UPDATES",
  "helper_modified_paths": [
    "examples/README.md",
    "scrolls/README.md",
    "tools/README.md"
  ],
  "helper_path": "sandbox/tmp/v3-2-6-package/apply_v3_2_6.py",
  "installation_id": "v3-2-6-repository-consolidation",
  "report_type": "supervised_package_installation_manifest",
  "schema_version": "1.0.0",
  "tracking_ref": "origin/main"
}
